group_id,actor_name,aliases,actor_type,country_attribution,targeted_sectors,mitre_description,technique_count,tactic_count,technique_diversity_score,associated_cve_count,avg_cvss_score,max_cvss_score,kev_count,critical_vuln_ratio,kev_ratio,acled_event_count,acled_political_violence_events_total,acled_months_observed,acled_avg_monthly_political_violence_events,acled_max_monthly_political_violence_events,geo_instability_score,conflict_intensity_index,capability_score,opportunity_score,activity_score,composite_risk_score,has_country_attribution,has_targeted_sector,has_cve_mapping
G0065,Leviathan,Leviathan; MUDCARP; Kryptonite Panda; Gadolinium; BRONZE MOHAWK; TEMP.Jumper; APT40; TEMP.Periscope; Gingham Typhoon,State,Australia; Canada; China,Critical Manufacturing; Defense Industrial Base; Government Facilities; Healthcare and Public Health; Transportation Systems,"[Leviathan](https://attack.mitre.org/groups/G0065) is a Chinese state-sponsored cyber espionage group that has been attributed to the Ministry of State Security's (MSS) Hainan State Security Department and an affiliated front company.(Citation: CISA AA21-200A APT40 July 2021) Active since at least 2009, [Leviathan](https://attack.mitre.org/groups/G0065) has targeted the following sectors: academia, aerospace/aviation, biomedical, defense industrial base, government, healthcare, manufacturing, maritime, and transportation across the US, Canada, Australia, Europe, the Middle East, and Southeast Asia.(Citation: CISA AA21-200A APT40 July 2021)(Citation: Proofpoint Leviathan Oct 2017)(Citation: FireEye Periscope March 2018)(Citation: CISA Leviathan 2024)",50,13,0.38461538461538464,5,8.6,9.8,4,0.4,0.8,2830,2830,101,28.019801980198018,182,0.009475277,0.009475277,0.6102130977130977,0.009475277,0.20333333333333334,0.36800160430198736,1,1,1
G0066,Elderwood,Elderwood; Elderwood Gang; Beijing Group; Sneaky Panda,,China,Defense Industrial Base; Government Facilities; NGO; Transportation Systems,"[Elderwood](https://attack.mitre.org/groups/G0066) is a suspected Chinese cyber espionage group that was reportedly responsible for the 2009 Google intrusion known as Operation Aurora. (Citation: Security Affairs Elderwood Sept 2012) The group has targeted defense organizations, supply chain manufacturers, human rights and nongovernmental organizations (NGOs), and IT service providers. (Citation: Symantec Elderwood Sept 2012) (Citation: CSM Elderwood Sept 2012)",9,4,0.069230769,0,0,0,0,0,0,2830,2830,101,28.019801980198018,182,0.009475277,0.009475277,0.034615385,0.009475277,0,0.019202747753130783,1,1,0
G0067,APT37,APT37; InkySquid; ScarCruft; Reaper; Group123; TEMP.Reaper; Ricochet Chollima,State,China; India; Japan; Kuwait; Nepal; North Korea; Romania; Russia; South Korea; Vietnam,NGO; Transportation Systems,"[APT37](https://attack.mitre.org/groups/G0067) is a North Korean state-sponsored cyber espionage group that has been active since at least 2012. The group has targeted victims primarily in South Korea, but also in Japan, Vietnam, Russia, Nepal, China, India, Romania, Kuwait, and other parts of the Middle East. [APT37](https://attack.mitre.org/groups/G0067) has also been linked to the following campaigns between 2016-2018: Operation Daybreak, Operation Erebus, Golden Time, Evil New Year, Are you Happy?, FreeMilk, North Korean Human Rights, and Evil New Year 2018.(Citation: FireEye APT37 Feb 2018)(Citation: Securelist ScarCruft Jun 2016)(Citation: Talos Group123)

North Korean group definitions are known to have significant overlap, and some security researchers report all North Korean state-sponsored cyber activity under the name [Lazarus Group](https://attack.mitre.org/groups/G0032) instead of tracking clusters or subgroups.",29,10,0.2230769230769231,7,7.685714285714286,9.8,6,0.14285714285714285,0.8571428571428571,39560,39560,197,391.6831683168317,1716,0.13245299191085874,0.13245299191085874,0.520563558,0.13245299191085874,0.2966666666666667,0.3757723774139508,1,1,1
G0068,PLATINUM,PLATINUM,,Unknown,Government Facilities,[PLATINUM](https://attack.mitre.org/groups/G0068) is an activity group that has targeted victims since at least 2009. The group has focused on targets associated with governments and related organizations in South and Southeast Asia. (Citation: Microsoft PLATINUM April 2016),11,7,0.084615385,1,7.8,7.8,1,0,1,0,0,0,0,0,0,0,0.4899428274428274,0,0.046666667,0.2589714137214137,1,1,1
G0069,MuddyWater,MuddyWater; Earth Vetala; MERCURY; Static Kitten; Seedworm; TEMP.Zagros; Mango Sandstorm; TA450; MuddyKrill,,Iran; Saudi Arabia,Communications; Defense Industrial Base; Energy; Financial Services; Government Facilities; Water and Wastewater Systems,"[MuddyWater](https://attack.mitre.org/groups/G0069) is a cyber espionage group assessed to be a subordinate element within Iran's Ministry of Intelligence and Security (MOIS).(Citation: CYBERCOM Iranian Intel Cyber January 2022) Since at least 2017, [MuddyWater](https://attack.mitre.org/groups/G0069) has targeted a range of government and private organizations across sectors, including telecommunications, local government, finance, defense, and oil and natural gas organizations, in the Middle East (specifically the UAE and Saudi Arabia), Asia, Africa, Europe, and North America. [MuddyWater](https://attack.mitre.org/groups/G0069) has reused domains dating back to October 2025, and has a preference for NameCheap and Hosterdaddy Private Limited (AS136557). In late 2025 and early 2026, [MuddyWater](https://attack.mitre.org/groups/G0069) used commercial satellite internet (i.e., Starlink) for command and control (C2) communication. (Citation: FalconFeeds_Iran_Mar2026)(Citation: Huntio_IranInfra_Mar2026)(Citation: Unit 42 MuddyWater Nov 2017)(Citation: Symantec MuddyWater Dec 2018)(Citation: ClearSky MuddyWater Nov 2018)(Citation: ClearSky MuddyWater June 2019)(Citation: Reaqta MuddyWater November 2017)(Citation: DHS CISA AA22-055A MuddyWater February 2022)(Citation: Talos MuddyWater Jan 2022)(Citation: NaumaanProofpoint_GlobalClickFix_April2025)(Citation: ESET_MuddyWater_Dec2025)(Citation: SymantecCarbonBlack_Seedworm_Mar2026)   ",68,14,0.5230769230769231,8,8.525,10,6,0.375,0.75,5342,5342,125,42.736,2238,0.017885841324262068,0.014451759790003748,0.6650435291060292,0.016855616863984572,0.31333333333333335,0.4298928879258115,1,1,1
G0070,Dark Caracal,Dark Caracal,State,Unknown,unknown,[Dark Caracal](https://attack.mitre.org/groups/G0070) is threat group that has been attributed to the Lebanese General Directorate of General Security (GDGS) and has operated since at least 2012. (Citation: Lookout Dark Caracal Jan 2018),12,8,0.092307692,1,8.8,8.8,0,0,0,0,0,0,0,0,0,0,0.26912681912681913,0,0.016666666666666666,0.13956340956340957,1,0,1
G0071,Orangeworm,Orangeworm,,United States,Healthcare and Public Health; Information Technology,"[Orangeworm](https://attack.mitre.org/groups/G0071) is a group that has targeted organizations in the healthcare sector in the United States, Europe, and Asia since at least 2015, likely for the purpose of corporate espionage.(Citation: Symantec Orangeworm April 2018) Reverse engineering of [Kwampirs](https://attack.mitre.org/software/S0236), directly associated with [Orangeworm](https://attack.mitre.org/groups/G0071) activity, indicates significant functional and development overlaps with [Shamoon](https://attack.mitre.org/software/S0140).(Citation: Cylera Kwampirs 2022)",2,2,0.015384615384615385,0,0,0,0,0,0,1077,1077,77,13.987012987012987,60,0.003605962,0.004729899,0.007692308,0.003943143,0,0.004634783,1,1,0
G0073,APT19,APT19; Codoso; C0d0so0; Codoso Team; Sunshop Group,,China,Communications; Critical Manufacturing; Defense Industrial Base; Education; Energy; Financial Services; Healthcare and Public Health,"[APT19](https://attack.mitre.org/groups/G0073) is a Chinese-based threat group that has targeted a variety of industries, including defense, finance, energy, pharmaceutical, telecommunications, high tech, education, manufacturing, and legal services. In 2017, a phishing campaign was used to target seven law and investment firms. (Citation: FireEye APT19) Some analysts track [APT19](https://attack.mitre.org/groups/G0073) and [Deep Panda](https://attack.mitre.org/groups/G0009) as the same group, but it is unclear from open source information if the groups are the same. (Citation: ICIT China's Espionage Jul 2016) (Citation: FireEye APT Groups) (Citation: Unit 42 C0d0so0 Jan 2016)",21,9,0.16153846153846155,0,0,0,0,0,0,2830,2830,101,28.019801980198018,182,0.009475277,0.009475277,0.080769231,0.009475277,0,0.042279670830053864,1,1,0
G0075,Rancor,Rancor,,Unknown,unknown,[Rancor](https://attack.mitre.org/groups/G0075) is a threat group that has led targeted campaigns against the South East Asia region. [Rancor](https://attack.mitre.org/groups/G0075) uses politically-motivated lures to entice victims to open malicious documents. (Citation: Rancor Unit42 June 2018),9,6,0.069230769,1,8.8,8.8,1,0,1,0,0,0,0,0,0,0,0.5075883575883575,0,0.046666667,0.26779417879417877,1,0,1
G0076,Thrip,Thrip,,Unknown,Communications; Defense Industrial Base,"[Thrip](https://attack.mitre.org/groups/G0076) is an espionage group that has targeted satellite communications, telecoms, and defense contractor companies in the U.S. and Southeast Asia. The group uses custom malware as well as ""living off the land"" techniques. (Citation: Symantec Thrip June 2018)",4,4,0.030769231,2,9.2,10,2,0.5,1,0,0,0,0,0,0,0,0.49849272349272344,0,0.093333333,0.27724636174636175,1,1,1
G0077,Leafminer,Leafminer; Raspite,,Iran,Government Facilities,[Leafminer](https://attack.mitre.org/groups/G0077) is an Iranian threat group that has targeted government organizations and business entities in the Middle East since at least early 2017. (Citation: Symantec Leafminer July 2018),17,9,0.13076923076923078,0,0,0,0,0,0,5342,5342,125,42.736,2238,0.017885841324262068,0.014451759790003748,0.065384615,0.016855616863984572,0,0.036063431,1,1,0
G0078,Gorgon Group,Gorgon Group,Nonstate CyberCrime,Pakistan; Russia; Spain; United Kingdom; United States,Government Facilities,"[Gorgon Group](https://attack.mitre.org/groups/G0078) is a threat group consisting of members who are suspected to be Pakistan-based or have other connections to Pakistan. The group has performed a mix of criminal and targeted attacks, including campaigns against government organizations in the United Kingdom, Spain, Russia, and the United States. (Citation: Unit 42 Gorgon Group Aug 2018)",16,8,0.12307692307692308,0,0,0,0,0,0,39560,39560,197,391.6831683168317,1716,0.13245299191085874,0.13245299191085874,0.061538462,0.13245299191085874,0,0.057259829,1,1,0
G0079,DarkHydrus,DarkHydrus,,Unknown,Education; Government Facilities,[DarkHydrus](https://attack.mitre.org/groups/G0079) is a threat group that has targeted government agencies and educational institutions in the Middle East since at least 2016. The group heavily leverages open-source tools and custom payloads for carrying out attacks. (Citation: Unit 42 DarkHydrus July 2018) (Citation: Unit 42 Playbook Dec 2017),7,5,0.053846154,0,0,0,0,0,0,0,0,0,0,0,0,0,0.026923076923076925,0,0,0.013461538461538462,1,1,0
G0080,Cobalt Group,Cobalt Group; GOLD KINGSWOOD; Cobalt Gang; Cobalt Spider,Nonstate CyberCrime,Spain,Emergency Services; Financial Services; Information Technology; Transportation Systems,"[Cobalt Group](https://attack.mitre.org/groups/G0080) is a financially motivated threat group that has primarily targeted financial institutions since at least 2016. The group has conducted intrusions to steal money via targeting ATM systems, card processing, payment systems and SWIFT systems. [Cobalt Group](https://attack.mitre.org/groups/G0080) has mainly targeted banks in Eastern Europe, Central Asia, and Southeast Asia. One of the alleged leaders was arrested in Spain in early 2018, but the group still appears to be active. The group has been known to target organizations in order to use their access to then compromise additional victims.(Citation: Talos Cobalt Group July 2018)(Citation: PTSecurity Cobalt Group Aug 2017)(Citation: PTSecurity Cobalt Dec 2016)(Citation: Group IB Cobalt Aug 2017)(Citation: Proofpoint Cobalt June 2017)(Citation: RiskIQ Cobalt Nov 2017)(Citation: RiskIQ Cobalt Jan 2018) Reporting indicates there may be links between [Cobalt Group](https://attack.mitre.org/groups/G0080) and both the malware [Carbanak](https://attack.mitre.org/software/S0030) and the group [Carbanak](https://attack.mitre.org/groups/G0008).(Citation: Europol Cobalt Mar 2018)",34,9,0.26153846153846155,9,8.411111111111111,10,9,0.2222222222222222,1,217,217,56,3.875,25,0.00072655,0.001310384,0.5938886001386001,0.0009017,0.42000000000000004,0.4231246400409077,1,1,1
G0081,Tropic Trooper,Tropic Trooper; Pirate Panda; KeyBoy,,Hong Kong; Philippines; Taiwan,Government Facilities; Healthcare and Public Health; Transportation Systems,"[Tropic Trooper](https://attack.mitre.org/groups/G0081) is an unaffiliated threat group that has led targeted campaigns against targets in Taiwan, the Philippines, and Hong Kong. [Tropic Trooper](https://attack.mitre.org/groups/G0081) focuses on targeting government, healthcare, transportation, and high-tech industries and has been active since 2011.(Citation: TrendMicro Tropic Trooper Mar 2018)(Citation: Unit 42 Tropic Trooper Nov 2016)(Citation: TrendMicro Tropic Trooper May 2020)",40,10,0.3076923076923077,3,8.133333333333335,8.8,3,0,1,14299,14299,125,114.392,714,0.047875261156050786,0.038683211,0.609927235,0.045117646,0.14,0.35598714668630993,1,1,1
G0082,APT38,APT38; NICKEL GLADSTONE; BeagleBoyz; Bluenoroff; Stardust Chollima; Sapphire Sleet; COPERNICIUM,State,Bangladesh; Chile; North Korea,Commercial Facilities; Financial Services; Transportation Systems,"[APT38](https://attack.mitre.org/groups/G0082) is a North Korean state-sponsored threat group that specializes in financial cyber operations; it has been attributed to the Reconnaissance General Bureau.(Citation: CISA AA20-239A BeagleBoyz August 2020) Active since at least 2014, [APT38](https://attack.mitre.org/groups/G0082) has targeted banks, financial institutions, casinos, cryptocurrency exchanges, SWIFT system endpoints, and ATMs in at least 38 countries worldwide. Significant operations include the 2016 Bank of Bangladesh heist, during which [APT38](https://attack.mitre.org/groups/G0082) stole $81 million, as well as attacks against Bancomext (Citation: FireEye APT38 Oct 2018) and Banco de Chile (Citation: FireEye APT38 Oct 2018); some of their attacks have been destructive.(Citation: CISA AA20-239A BeagleBoyz August 2020)(Citation: FireEye APT38 Oct 2018)(Citation: DOJ North Korea Indictment Feb 2021)(Citation: Kaspersky Lazarus Under The Hood Blog 2017)

North Korean group definitions are known to have significant overlap, and some security researchers report all North Korean state-sponsored cyber activity under the name [Lazarus Group](https://attack.mitre.org/groups/G0032) instead of tracking clusters or subgroups.",56,12,0.4307692307692308,3,8.8,9.8,2,0.3333333333333333,0.6666666666666666,15101,15101,197,76.65482233502539,334,0.050560481,0.025921871001759668,0.605024255,0.043168898,0.11,0.34414590712103044,1,1,1
G0083,SilverTerrier,SilverTerrier,,Unknown,Critical Manufacturing; Education; Information Technology,"[SilverTerrier](https://attack.mitre.org/groups/G0083) is a Nigerian threat group that has been seen active since 2014. [SilverTerrier](https://attack.mitre.org/groups/G0083) mainly targets organizations in high technology, higher education, and manufacturing.(Citation: Unit42 SilverTerrier 2018)(Citation: Unit42 SilverTerrier 2016)",4,2,0.030769231,0,0,0,0,0,0,0,0,0,0,0,0,0,0.015384615384615385,0,0,0.007692308,1,1,0
G0084,Gallmaker,Gallmaker,,Unknown,Defense Industrial Base; Government Facilities,"[Gallmaker](https://attack.mitre.org/groups/G0084) is a cyberespionage group that has targeted victims in the Middle East and has been active since at least December 2017. The group has mainly targeted victims in the defense, military, and government sectors.(Citation: Symantec Gallmaker Oct 2018)",6,4,0.046153846153846156,0,0,0,0,0,0,0,0,0,0,0,0,0,0.023076923076923078,0,0,0.011538461538461539,1,1,0
G0085,FIN4,FIN4,,Unknown,Financial Services; Healthcare and Public Health,"[FIN4](https://attack.mitre.org/groups/G0085) is a financially-motivated threat group that has targeted confidential information related to the public financial market, particularly regarding healthcare and pharmaceutical companies, since at least 2013.(Citation: FireEye Hacking FIN4 Dec 2014)(Citation: FireEye FIN4 Stealing Insider NOV 2014) [FIN4](https://attack.mitre.org/groups/G0085) is unique in that they do not infect victims with typical persistent malware, but rather they focus on capturing credentials authorized to access email and other non-public correspondence.(Citation: FireEye Hacking FIN4 Dec 2014)(Citation: FireEye Hacking FIN4 Video Dec 2014)",12,8,0.092307692,0,0,0,0,0,0,0,0,0,0,0,0,0,0.046153846153846156,0,0,0.023076923076923078,1,1,0
G0087,APT39,APT39; ITG07; Chafer; Remix Kitten,,Iran,Communications; Education; Government Facilities; Healthcare and Public Health,"[APT39](https://attack.mitre.org/groups/G0087) is one of several names for cyber espionage activity conducted by the Iranian Ministry of Intelligence and Security (MOIS) through the front company Rana Intelligence Computing since at least 2014. [APT39](https://attack.mitre.org/groups/G0087) has primarily targeted the travel, hospitality, academic, and telecommunications industries in Iran and across Asia, Africa, Europe, and North America to track individuals and entities considered to be a threat by the MOIS.(Citation: FireEye APT39 Jan 2019)(Citation: Symantec Chafer Dec 2015)(Citation: FBI FLASH APT39 September 2020)(Citation: Dept. of Treasury Iran Sanctions September 2020)(Citation: DOJ Iran Indictments September 2020)",53,13,0.4076923076923077,2,9.8,9.8,1,1,0.5,5342,5342,125,42.736,2238,0.017885841324262068,0.014451759790003748,0.5771569646569646,0.016855616863984572,0.063333333,0.3109496057012793,1,1,1
G0088,TEMP.Veles,TEMP.Veles; XENOTIME,,Russia,Critical Manufacturing; Emergency Services; Information Technology,"[TEMP.Veles](https://attack.mitre.org/groups/G0088) is a Russia-based threat group that has targeted critical infrastructure. The group has been observed utilizing [TRITON](https://attack.mitre.org/software/S0609), a malware framework designed to manipulate industrial safety systems.(Citation: FireEye TRITON 2019)(Citation: FireEye TEMP.Veles 2018)(Citation: FireEye TEMP.Veles JSON April 2019)",0,0,0,0,0,0,0,0,0,39560,39560,101,391.6831683168317,1716,0.13245299191085874,0.13245299191085874,0,0.13245299191085874,0,0.026490598,1,1,0
G0089,The White Company,The White Company,State,Pakistan,Defense Industrial Base; Government Facilities,"[The White Company](https://attack.mitre.org/groups/G0089) is a likely state-sponsored threat actor with advanced capabilities. From 2017 through 2018, the group led an espionage campaign called Operation Shaheen targeting government and military organizations in Pakistan.(Citation: Cylance Shaheen Nov 2018)",7,4,0.053846154,0,0,0,0,0,0,26749,26749,197,135.78172588832487,392,0.089559785,0.045916437813791754,0.026923076923076925,0.076466781,0,0.028754894580904352,1,1,0
G0090,WIRTE,WIRTE; Ashen Lepus,,Israel; Palestine,Defense Industrial Base; Financial Services; Government Facilities; Information Technology; NGO,"[WIRTE](https://attack.mitre.org/groups/G0090) is a cyberespionage actor, believed to be a subgroup of the Hamas-affiliated Gaza Cybergang, that has been active since at least August 2018. [WIRTE](https://attack.mitre.org/groups/G0090) has targeted diplomatic, financial, military, legal, and technology organizations across the Middle East, North Africa, and in Europe to gather intelligence. [WIRTE](https://attack.mitre.org/groups/G0090) has remained persistently active despite the ongoing Israel-Hamas conflict and has expanded their operations to include wiper malware attacks against Israeli targets.(Citation: Lab52 WIRTE Apr 2019)(Citation: Kaspersky WIRTE November 2021)(Citation: Check Point Wirte NOV 2024)(Citation: Palo Alto Ashen Lepus DEC 2025)",26,8,0.2,0,0,0,0,0,0,69066,69066,125,552.528,2098,0.23124363850645524,0.18684485991321584,0.1,0.2179240049284834,0,0.093584801,1,1,0
G0091,Silence,Silence; Whisper Spider,Nonstate CyberCrime,Azerbaijan; Belarus; Kazakhstan; Poland; Russia; Ukraine,Emergency Services; Financial Services,"[Silence](https://attack.mitre.org/groups/G0091) is a financially motivated threat actor targeting financial institutions in different countries. The group was first seen in June 2016. Their main targets reside in Russia, Ukraine, Belarus, Azerbaijan, Poland and Kazakhstan. They compromised various banking systems, including the Russian Central Bank's Automated Workstation Client, ATMs, and card processing.(Citation: Cyber Forensicator Silence Jan 2019)(Citation: SecureList Silence Nov 2017) ",28,12,0.2153846153846154,1,8.8,8.8,0,0,0,298672,298672,101,2957.1485148514853,7824,1,1,0.33066528066528067,1,0.016666666666666666,0.37033264033264035,1,1,1
G0092,TA505,TA505; Hive0065; Spandex Tempest; CHIMBORAZO,Nonstate CyberCrime,Unknown,Information Technology,"[TA505](https://attack.mitre.org/groups/G0092) is a cyber criminal group that has been active since at least 2014. [TA505](https://attack.mitre.org/groups/G0092) is known for frequently changing malware, driving global trends in criminal malware distribution, and ransomware campaigns involving [Clop](https://attack.mitre.org/software/S0611).(Citation: Proofpoint TA505 Sep 2017)(Citation: Proofpoint TA505 June 2018)(Citation: Proofpoint TA505 Jan 2019)(Citation: NCC Group TA505)(Citation: Korean FSI TA505 2020)",34,11,0.26153846153846155,0,0,0,0,0,0,0,0,0,0,0,0,0,0.13076923076923078,0,0,0.065384615,1,1,0
G0093,GALLIUM,GALLIUM; Granite Typhoon,State,Afghanistan; Australia; Belgium; Cambodia; China; Malaysia; Mozambique; Philippines; Russia; Vietnam,Communications; Financial Services; Government Facilities,"[GALLIUM](https://attack.mitre.org/groups/G0093) is a cyberespionage group that has been active since at least 2012, primarily targeting telecommunications companies, financial institutions, and government entities in Afghanistan, Australia, Belgium, Cambodia, Malaysia, Mozambique, the Philippines, Russia, and Vietnam. This group is particularly known for launching Operation Soft Cell, a long-term campaign targeting telecommunications providers.(Citation: Cybereason Soft Cell June 2019) Security researchers have identified [GALLIUM](https://attack.mitre.org/groups/G0093) as a likely Chinese state-sponsored group, based in part on tools used and TTPs commonly associated with Chinese threat actors.(Citation: Cybereason Soft Cell June 2019)(Citation: Microsoft GALLIUM December 2019)(Citation: Unit 42 PingPull Jun 2022)",31,13,0.23846153846153847,3,8.200000000000001,9.8,1,0.6666666666666666,0.3333333333333333,64698,64698,353,572.5486725663717,1716,0.21661889966250603,0.19361512270719564,0.41033437283437285,0.2097177665759129,0.08,0.27111073973236904,1,1,1
G0094,Kimsuky,Kimsuky; Black Banshee; Velvet Chollima; Emerald Sleet; THALLIUM; APT43; TA427; Springtail; Earth Kumiho; PatheticSlug,State,Japan; North Korea; Russia; South Korea; United States,Critical Manufacturing; Education; Energy; Government Facilities; NGO; Transportation Systems,"[Kimsuky](https://attack.mitre.org/groups/G0094) is a Democratic People's Republic of Korea (DPRK)-based cyber espionage group that has been active since at least 2012. The group initially targeted South Korean government agencies, think tanks, and subject-matter experts in various fields. Its operations expanded to include the United Nations and organizations in the government, education, business services, and manufacturing sectors across the United States, Japan, Russia, and Europe. [Kimsuky](https://attack.mitre.org/groups/G0094) has focused collection on foreign policy and national security issues tied to the Korean Peninsula, nuclear policy, and sanctions. [Kimsuky](https://attack.mitre.org/groups/G0094) operations have overlapped with those of other North Korean state-sponsored cyber espionage actors as a result of ad hoc collaborations or other limited resource sharing.(Citation: EST Kimsuky April 2019)(Citation: Cybereason Kimsuky November 2020)(Citation: Malwarebytes Kimsuky June 2021)(Citation: CISA AA20-301A Kimsuky)(Citation: Mandiant APT43 March 2024)(Citation: Proofpoint TA427 April 2024) 

[Kimsuky](https://attack.mitre.org/groups/G0094) was assessed to be responsible for the 2014 Korea Hydro & Nuclear Power Co. compromise; other notable campaigns include Operation STOLEN PENCIL (2018), Operation Kabar Cobra (2019), and Operation Smoke Screen (2019).(Citation: Netscout Stolen Pencil Dec 2018)(Citation: EST Kimsuky SmokeScreen April 2019)(Citation: AhnLab Kimsuky Kabar Cobra Feb 2019) In 2023, [Kimsuky](https://attack.mitre.org/groups/G0094) was observed using commercial large language models (LLMs) to assist with vulnerability research, scripting, social engineering and reconnaissance.(Citation: MSFT-AI)

DPRK threat actor cluster boundaries overlap in open source reporting, with some security researchers consolidating all attributed North Korean state-sponsored cyber activity under [Lazarus Group](https://attack.mitre.org/groups/G0032), rather than tracking operationally distinct subgroups.",130,15,1,6,9.1,10,5,0.5,0.8333333333333334,39560,39560,101,391.6831683168317,1716,0.13245299191085874,0.13245299191085874,0.9389076576576577,0.13245299191085874,0.25,0.5709444272110006,1,1,1
