group_id,actor_name,aliases,actor_type,country_attribution,targeted_sectors,mitre_description,technique_count,tactic_count,technique_diversity_score,associated_cve_count,avg_cvss_score,max_cvss_score,kev_count,critical_vuln_ratio,kev_ratio,acled_event_count,acled_political_violence_events_total,acled_months_observed,acled_avg_monthly_political_violence_events,acled_max_monthly_political_violence_events,geo_instability_score,conflict_intensity_index,capability_score,opportunity_score,activity_score,composite_risk_score,has_country_attribution,has_targeted_sector,has_cve_mapping
G0095,Machete,Machete; APT-C-43; El Machete,,Russia; Venezuela,Communications; Defense Industrial Base; Energy; Government Facilities,"[Machete](https://attack.mitre.org/groups/G0095) is a suspected Spanish-speaking cyber espionage group that has been active since at least 2010. It has primarily focused its operations within Latin America, with a particular emphasis on Venezuela, but also in the US, Europe, Russia, and parts of Asia. [Machete](https://attack.mitre.org/groups/G0095) generally targets high-profile organizations such as government institutions, intelligence services, and military units, as well as telecommunications and power companies.(Citation: Cylance Machete Mar 2017)(Citation: Securelist Machete Aug 2014)(Citation: ESET Machete July 2019)(Citation: 360 Machete Sep 2020)",11,5,0.084615385,0,0,0,0,0,0,39560,39560,101,391.6831683168317,1716,0.13245299191085874,0.13245299191085874,0.042307692,0.13245299191085874,0,0.047644444536017905,1,1,0
G0096,APT41,APT41; Wicked Panda; Brass Typhoon; BARIUM,State,China,Commercial Facilities; Communications; Education; Financial Services; Healthcare and Public Health; Information Technology; Transportation Systems,"[APT41](https://attack.mitre.org/groups/G0096) is a threat group that researchers have assessed as Chinese state-sponsored espionage group that also conducts financially-motivated operations. Active since at least 2012, [APT41](https://attack.mitre.org/groups/G0096) has been observed targeting various industries, including but not limited to healthcare, telecom, technology, finance, education, retail and video game industries in 14 countries.(Citation: apt41_mandiant) Notable behaviors include using a wide range of malware and tools to complete mission objectives. [APT41](https://attack.mitre.org/groups/G0096) overlaps at least partially with public reporting on groups including BARIUM and [Winnti Group](https://attack.mitre.org/groups/G0044).(Citation: FireEye APT41 Aug 2019)(Citation: Group IB APT 41 June 2021)
",82,15,0.6307692307692307,13,8.625,9.8,9,0.46153846153846156,0.6923076923076923,2830,2830,101,28.019801980198018,182,0.009475277,0.009475277,0.7070003898128898,0.009475277,0.4866666666666667,0.5013952503518834,1,1,1
G0098,BlackTech,BlackTech; Palmerworm,,China; Hong Kong; Japan; Taiwan,Critical Manufacturing; Financial Services; Media,"[BlackTech](https://attack.mitre.org/groups/G0098) is a suspected Chinese cyber espionage group that has primarily targeted organizations in East Asia--particularly Taiwan, Japan, and Hong Kong--and the US since at least 2013. [BlackTech](https://attack.mitre.org/groups/G0098) has used a combination of custom malware, dual-use tools, and living off the land tactics to compromise media, construction, engineering, electronics, and financial company networks.(Citation: TrendMicro BlackTech June 2017)(Citation: Symantec Palmerworm Sep 2020)(Citation: Reuters Taiwan BlackTech August 2020)",14,6,0.1076923076923077,7,9.085714285714287,9.8,6,0.5714285714285714,0.8571428571428571,2830,2830,101,28.019801980198018,182,0.009475277,0.009475277,0.49834422334422335,0.009475277,0.2966666666666667,0.3400671671175502,1,1,1
G0099,APT-C-36,APT-C-36; Blind Eagle; TAG-144; AguilaCiega; APT-Q-98,Nonstate CyberCrime,Colombia; United States,Critical Manufacturing; Energy; Financial Services; Government Facilities,"[APT-C-36](https://attack.mitre.org/groups/G0099) is a suspected South American threat group that has engaged in espionage and financially motivated operations since at least 2018. [APT-C-36](https://attack.mitre.org/groups/G0099) has targeted government institutions and entities in the financial, energy, and professional manufacturing sectors across Colombia and other Latin American countries.(Citation: QiAnXin APT-C-36 Feb2019)(Citation: Kaspersky BlindEagle AUG 2024)(Citation: Check Point Blind Eagle MAR 2025)(Citation: Recorded Future TAG-144 AUG 2025)",38,9,0.2923076923076923,2,7.15,7.8,2,0,1,19712,19712,101,195.16831683168317,304,0.065998821,0.065998821,0.5773193866943866,0.065998821,0.093333333,0.32985945763711677,1,1,1
G0100,Inception,Inception; Inception Framework; Cloud Atlas,,Russia; United States,Government Facilities; Information Technology,"[Inception](https://attack.mitre.org/groups/G0100) is a cyber espionage group active since at least 2014. The group has targeted multiple industries and governmental entities primarily in Russia, but has also been active in the United States and throughout Europe, Asia, Africa, and the Middle East.(Citation: Unit 42 Inception November 2018)(Citation: Symantec Inception Framework March 2018)(Citation: Kaspersky Cloud Atlas December 2014)",22,10,0.16923076923076924,5,8,8.8,5,0,1,39560,39560,101,391.6831683168317,1716,0.13245299191085874,0.13245299191085874,0.5373180873180873,0.13245299191085874,0.23333333333333334,0.3651496420412154,1,1,1
G0102,Wizard Spider,Wizard Spider; UNC1878; TEMP.MixMaster; Grim Spider; FIN12; GOLD BLACKBURN; ITG23; Periwinkle Tempest; DEV-0193; Pistachio Tempest; DEV-0237,Nonstate CyberCrime,Russia,Financial Services; Healthcare and Public Health; Information Technology,"[Wizard Spider](https://attack.mitre.org/groups/G0102) is a Russia-based financially motivated threat group originally known for the creation and deployment of [TrickBot](https://attack.mitre.org/software/S0266) since at least 2016. [Wizard Spider](https://attack.mitre.org/groups/G0102) possesses a diverse arsenal of tools and has conducted ransomware campaigns against a variety of organizations, ranging from major corporations to hospitals.(Citation: CrowdStrike Ryuk January 2019)(Citation: DHS/CISA Ransomware Targeting Healthcare October 2020)(Citation: CrowdStrike Wizard Spider October 2020)",64,14,0.49230769230769234,4,8.3,9.8,2,0.5,0.5,39560,39560,101,391.6831683168317,1716,0.13245299191085874,0.13245299191085874,0.5814579002079002,0.13245299191085874,0.12666666666666665,0.35521954848612186,1,1,1
G0103,Mofang,Mofang,,China; Myanmar,Defense Industrial Base; Government Facilities,"[Mofang](https://attack.mitre.org/groups/G0103) is a likely China-based cyber espionage group, named for its frequent practice of imitating a victim's infrastructure. This adversary has been observed since at least May 2012 conducting focused attacks against government and critical infrastructure in Myanmar, as well as several other countries and sectors including military, automobile, and weapons industries.(Citation: FOX-IT May 2016 Mofang)",6,3,0.046153846153846156,0,0,0,0,0,0,67703,67703,197,343.6700507614213,1461,0.2266801039267156,0.11621670302841762,0.023076923076923078,0.1935410836572262,0,0.050246678,1,1,0
G0105,DarkVishnya,DarkVishnya,Nonstate CyberCrime,Unknown,Financial Services,[DarkVishnya](https://attack.mitre.org/groups/G0105) is a financially motivated threat actor targeting financial institutions in Eastern Europe. In 2017-2018 the group attacked at least 8 banks in this region.(Citation: Securelist DarkVishnya Dec 2018),10,8,0.076923077,2,9.2,10,2,0.5,1,0,0,0,0,0,0,0,0.5215696465696466,0,0.093333333,0.28878482328482324,1,1,1
G0106,Rocke,Rocke,Nonstate CyberCrime,China,Financial Services,"[Rocke](https://attack.mitre.org/groups/G0106) is an alleged Chinese-speaking adversary whose primary objective appeared to be cryptojacking, or stealing victim system resources for the purposes of mining cryptocurrency. The name [Rocke](https://attack.mitre.org/groups/G0106) comes from the email address ""rocke@live.cn"" used to create the wallet which held collected cryptocurrency. Researchers have detected overlaps between [Rocke](https://attack.mitre.org/groups/G0106) and the Iron Cybercrime Group, though this attribution has not been confirmed.(Citation: Talos Rocke August 2018)",36,11,0.27692307692307694,4,9.225000000000001,9.8,3,0.75,0.75,2830,2830,101,28.019801980198018,182,0.009475277,0.009475277,0.5597030925155926,0.009475277,0.15666666666666668,0.3287466017032348,1,1,1
G0107,Whitefly,Whitefly,,Singapore,Healthcare and Public Health,"[Whitefly](https://attack.mitre.org/groups/G0107) is a cyber espionage group that has been operating since at least 2017. The group has targeted organizations based mostly in Singapore across a wide variety of sectors, and is primarily interested in stealing large amounts of sensitive information. The group has been linked to an attack against Singapore’s largest public health organization, SingHealth.(Citation: Symantec Whitefly March 2019)",9,6,0.069230769,1,7.8,7.8,0,0,0,0,0,24,0,0,0,0,0.23225051975051975,0,0.016666666666666666,0.12112525987525988,1,1,1
G0108,Blue Mockingbird,Blue Mockingbird,,Unknown,Emergency Services; Financial Services,[Blue Mockingbird](https://attack.mitre.org/groups/G0108) is a cluster of observed activity involving Monero cryptocurrency-mining payloads in dynamic-link library (DLL) form on Windows systems. The earliest observed Blue Mockingbird tools were created in December 2019.(Citation: RedCanary Mockingbird May 2020),22,12,0.16923076923076924,3,9.8,9.8,2,1,0.6666666666666666,0,0,0,0,0,0,0,0.49959286209286213,0,0.11,0.28279643104643104,1,1,1
G0112,Windshift,Windshift; Bahamut,,Unknown,Government Facilities,"[Windshift](https://attack.mitre.org/groups/G0112) is a threat group that has been active since at least 2017, targeting specific individuals for surveillance in government departments and critical infrastructure across the Middle East.(Citation: SANS Windshift August 2018)(Citation: objective-see windtail1 dec 2018)(Citation: objective-see windtail2 jan 2019)",19,7,0.14615384615384616,0,0,0,0,0,0,0,0,0,0,0,0,0,0.073076923,0,0,0.036538462,1,1,0
G0114,Chimera,Chimera,,China; Taiwan,Critical Manufacturing; Transportation Systems,[Chimera](https://attack.mitre.org/groups/G0114) is a suspected China-based threat group that has been active since at least 2018 targeting the semiconductor industry in Taiwan as well as data from the airline industry.(Citation: Cycraft Chimera April 2020)(Citation: NCC Group Chimera January 2021),59,14,0.45384615384615384,0,0,0,0,0,0,2830,2830,101,28.019801980198018,182,0.009475277,0.009475277,0.22692307692307692,0.009475277,0,0.11535659390697693,1,1,0
G0115,GOLD SOUTHFIELD,GOLD SOUTHFIELD; Pinchy Spider,Nonstate CyberCrime,Unknown,Financial Services; Information Technology,"[GOLD SOUTHFIELD](https://attack.mitre.org/groups/G0115) is a financially motivated threat group active since at least 2018 that operates the [REvil](https://attack.mitre.org/software/S0496) Ransomware-as-a Service (RaaS). [GOLD SOUTHFIELD](https://attack.mitre.org/groups/G0115) provides backend infrastructure for affiliates recruited on underground forums to perpetrate high value deployments. By early 2020, [GOLD SOUTHFIELD](https://attack.mitre.org/groups/G0115) started capitalizing on the new trend of stealing data and further extorting the victim to pay for their data to not get publicly leaked.(Citation: Secureworks REvil September 2019)(Citation: Secureworks GandCrab and REvil September 2019)(Citation: Secureworks GOLD SOUTHFIELD)(Citation: CrowdStrike Evolution of Pinchy Spider July 2021)",9,6,0.069230769,4,9.5,10,3,0.75,0.75,0,0,0,0,0,0,0,0.4628248440748441,0,0.15666666666666668,0.27841242203742206,1,1,1
G0117,Fox Kitten,Fox Kitten; UNC757; Parisite; Pioneer Kitten; RUBIDIUM; Lemon Sandstorm,,Australia; Iran,Critical Manufacturing; Defense Industrial Base; Energy; Government Facilities; Healthcare and Public Health; Information Technology,"[Fox Kitten](https://attack.mitre.org/groups/G0117) is threat actor with a suspected nexus to the Iranian government that has been active since at least 2017 against entities in the Middle East, North Africa, Europe, Australia, and North America. [Fox Kitten](https://attack.mitre.org/groups/G0117) has targeted multiple industrial verticals including oil and gas, technology, government, defense, healthcare, manufacturing, and engineering.(Citation: ClearkSky Fox Kitten February 2020)(Citation: CrowdStrike PIONEER KITTEN August 2020)(Citation: Dragos PARISITE )(Citation: ClearSky Pay2Kitten December 2020)",41,11,0.3153846153846154,7,8.971428571428572,10,4,0.7142857142857143,0.5714285714285714,5342,5342,125,42.736,2238,0.017885841324262068,0.014451759790003748,0.5278660528660528,0.016855616863984572,0.2366666666666667,0.33830414980582335,1,1,1
G0119,Indrik Spider,Indrik Spider; Evil Corp; Manatee Tempest; DEV-0243; UNC2165,Nonstate CyberCrime,Russia,Financial Services; Information Technology,"[Indrik Spider](https://attack.mitre.org/groups/G0119) is a Russia-based cybercriminal group that has been active since at least 2014. [Indrik Spider](https://attack.mitre.org/groups/G0119) initially started with the [Dridex](https://attack.mitre.org/software/S0384) banking Trojan, and then by 2017 they began running ransomware operations using [BitPaymer](https://attack.mitre.org/software/S0570), [WastedLocker](https://attack.mitre.org/software/S0612), and Hades ransomware. Following U.S. sanctions and an indictment in 2019, [Indrik Spider](https://attack.mitre.org/groups/G0119) changed their tactics and diversified their toolset.(Citation: Crowdstrike Indrik November 2018)(Citation: Crowdstrike EvilCorp March 2021)(Citation: Treasury EvilCorp Dec 2019)",33,15,0.25384615384615383,2,6.35,7.2,1,0,0.5,39560,39560,101,391.6831683168317,1716,0.13245299191085874,0.13245299191085874,0.4128183471933472,0.13245299191085874,0.063333333,0.25189977197884533,1,1,1
G0120,Evilnum,Evilnum,Nonstate CyberCrime,Unknown,Financial Services,[Evilnum](https://attack.mitre.org/groups/G0120) is a financially motivated threat group that has been active since at least 2018.(Citation: ESET EvilNum July 2020),11,7,0.084615385,2,9.2,10,2,0.5,1,0,0,0,0,0,0,0,0.5254158004158004,0,0.093333333,0.29070790020790016,1,1,1
G0121,Sidewinder,Sidewinder; T-APT-04; Rattlesnake,,Afghanistan; China; India; Nepal; Pakistan,Defense Industrial Base; Government Facilities,"[Sidewinder](https://attack.mitre.org/groups/G0121) is a suspected Indian threat actor group that has been active since at least 2012. They have been observed targeting government, military, and business entities throughout Asia, primarily focusing on Pakistan, China, Nepal, and Afghanistan.(Citation: ATT Sidewinder January 2021)(Citation: Securelist APT Trends April 2018)(Citation: Cyble Sidewinder September 2020)",30,10,0.23076923076923078,3,7.7,7.8,3,0,1,64698,64698,197,572.5486725663717,1675,0.21661889966250603,0.19361512270719564,0.5604859667359667,0.2097177665759129,0.14,0.3641865366831659,1,1,1
G0122,Silent Librarian,Silent Librarian; TA407; COBALT DICKENS,,Iran,Government Facilities,"[Silent Librarian](https://attack.mitre.org/groups/G0122) is a group that has targeted research and proprietary data at universities, government agencies, and private sector companies worldwide since at least 2013. Members of  [Silent Librarian](https://attack.mitre.org/groups/G0122) are known to have been affiliated with the Iran-based Mabna Institute which has conducted cyber intrusions at the behest of the government of Iran, specifically the Islamic Revolutionary Guard Corps (IRGC).(Citation: DOJ Iran Indictments March 2018)(Citation: Phish Labs Silent Librarian)(Citation: Malwarebytes Silent Librarian October 2020)",13,8,0.1,0,0,0,0,0,0,5342,5342,125,42.736,2238,0.017885841324262068,0.014451759790003748,0.05,0.016855616863984572,0,0.028371123372796916,1,1,0
G0123,Volatile Cedar,Volatile Cedar; Lebanese Cedar,,Unknown,unknown,"[Volatile Cedar](https://attack.mitre.org/groups/G0123) is a Lebanese threat group that has targeted individuals, companies, and institutions worldwide. [Volatile Cedar](https://attack.mitre.org/groups/G0123) has been operating since 2012 and is motivated by political and ideological interests.(Citation: CheckPoint Volatile Cedar March 2015)(Citation: ClearSky Lebanese Cedar Jan 2021)",5,4,0.038461538461538464,2,9.8,9.8,1,1,0.5,0,0,0,0,0,0,0,0.3925415800415801,0,0.063333333,0.21527079002079003,1,0,1
G0124,Windigo,Windigo,,Unknown,Information Technology,"The [Windigo](https://attack.mitre.org/groups/G0124) group has been operating since at least 2011, compromising thousands of Linux and Unix servers using the [Ebury](https://attack.mitre.org/software/S0377) SSH backdoor to create a spam botnet. Despite law enforcement intervention against the creators, [Windigo](https://attack.mitre.org/groups/G0124) operators continued updating [Ebury](https://attack.mitre.org/software/S0377) through 2019.(Citation: ESET Windigo Mar 2014)(Citation: CERN Windigo June 2019)",7,5,0.053846154,0,0,0,0,0,0,0,0,0,0,0,0,0,0.026923076923076925,0,0,0.013461538461538462,1,1,0
G0125,HAFNIUM,HAFNIUM; Operation Exchange Marauder; Silk Typhoon,State,China,Defense Industrial Base; Education; Information Technology; NGO,"[HAFNIUM](https://attack.mitre.org/groups/G0125) is a likely state-sponsored cyber espionage group operating out of China that has been active since at least January 2021. [HAFNIUM](https://attack.mitre.org/groups/G0125) primarily targets entities in the US across a number of industry sectors, including infectious disease researchers, law firms, higher education institutions, defense contractors, policy think tanks, and NGOs. [HAFNIUM](https://attack.mitre.org/groups/G0125) has targeted remote management tools and cloud software for intial access and has demonstrated an ability to quickly operationalize exploits for identified vulnerabilities in edge devices.(Citation: Microsoft HAFNIUM March 2020)(Citation: Volexity Exchange Marauder March 2021)(Citation: Microsoft Silk Typhoon MAR 2025)",44,14,0.3384615384615385,3,9.566666666666668,9.8,2,1,0.6666666666666666,2830,2830,101,28.019801980198018,182,0.009475277,0.009475277,0.5782960845460846,0.009475277,0.11,0.32404309771848083,1,1,1
G0126,Higaisa,Higaisa,,China; Japan; North Korea; Poland; Russia; South Korea,Government Facilities,"[Higaisa](https://attack.mitre.org/groups/G0126) is a threat group suspected to have South Korean origins. [Higaisa](https://attack.mitre.org/groups/G0126) has targeted government, public, and trade organizations in North Korea; however, they have also carried out attacks in China, Japan, Russia, Poland, and other nations. [Higaisa](https://attack.mitre.org/groups/G0126) was first disclosed in early 2019 but is assessed to have operated as early as 2009.(Citation: Malwarebytes Higaisa 2020)(Citation: Zscaler Higaisa 2020)(Citation: PTSecurity Higaisa 2020)",28,8,0.2153846153846154,1,8.8,8.8,1,0,1,39560,39560,101,391.6831683168317,1716,0.13245299191085874,0.13245299191085874,0.5806652806652807,0.13245299191085874,0.046666667,0.3308232387148121,1,1,1
G0127,TA551,TA551; GOLD CABIN; Shathak,,Unknown,Financial Services,"[TA551](https://attack.mitre.org/groups/G0127) is a financially-motivated threat group that has been active since at least 2018. (Citation: Secureworks GOLD CABIN) The group has primarily targeted English, German, Italian, and Japanese speakers through email-based malware distribution campaigns. (Citation: Unit 42 TA551 Jan 2021)",14,5,0.1076923076923077,1,7.8,7.8,1,0,1,0,0,0,0,0,0,0,0.501481289,0,0.046666667,0.2647406444906445,1,1,1
G0128,ZIRCONIUM,ZIRCONIUM; APT31; Violet Typhoon,,China,unknown,"[ZIRCONIUM](https://attack.mitre.org/groups/G0128) is a threat group operating out of China, active since at least 2017, that has targeted individuals associated with the 2020 US presidential election and prominent leaders in the international affairs community.(Citation: Microsoft Targeting Elections September 2020)(Citation: Check Point APT31 February 2021)",29,11,0.2230769230769231,3,8.033333333333333,9.8,2,0.3333333333333333,0.6666666666666666,2830,2830,101,28.019801980198018,182,0.009475277,0.009475277,0.4817524255024255,0.009475277,0.11,0.2757712681966512,1,0,1
G0129,Mustang Panda,Mustang Panda; TA416; RedDelta; BRONZE PRESIDENT; STATELY TAURUS; FIREANT; CAMARO DRAGON; EARTH PRETA; HIVE0154; TWILL TYPHOON; TANTALUM; LUMINOUS MOTH; UNC6384; TEMP.Hex; Red Lich; ClumsyToad,,China; Mongolia; Myanmar; Pakistan; Russia; United States; Vietnam,Government Facilities; NGO,"[Mustang Panda](https://attack.mitre.org/groups/G0129) is a China-based cyber espionage threat actor that has been conducting operations since at least 2012. [Mustang Panda](https://attack.mitre.org/groups/G0129) has been known to use tailored phishing lures and decoy documents to deliver malicious payloads.  [Mustang Panda](https://attack.mitre.org/groups/G0129) has targeted government, diplomatic, and non-governmental organizations, including think tanks, religious institutions, and research entities, across the United States, Europe, and Asia, with notable activity in Russia, Mongolia, Myanmar, Pakistan, and Vietnam. (Citation: BlackBerry MUSTANG PANDA October 2022)(Citation: Eset PlugX Korplug Mustang Panda March 2022)(Citation: Anomali MUSTANG PANDA October 2019)(Citation: Cisco Talos MUSTANG PANDA PLUGX PUBLOAD MAY 2022)(Citation: Secureworks BRONZE PRESIDENT December 2019)(Citation: DOJ Affidavit Search and Seizure PlugX December 2024)(Citation: EclecticIQ Mustang Panda PlugX)(Citation: ATTACKIQ MUSTANG PANDA TONESHELL March 2023)(Citation: Crowdstrike MUSTANG PANDA June 2018)(Citation: Palo Alto Networks, Unit 42)(Citation: Sophos PlugX September 2022)(Citation: Sophos Mustang Panda PLUGX)(Citation: Zscaler)",85,14,0.6538461538461539,3,8.733333333333334,10,3,0.3333333333333333,1,67703,67703,197,391.6831683168317,1716,0.2266801039267156,0.13245299191085874,0.7982068607068608,0.19841197032195854,0.14,0.4807858244178221,1,1,1
G0130,Ajax Security Team,Ajax Security Team; Operation Woolen-Goldfish; AjaxTM; Rocket Kitten; Flying Kitten; Operation Saffron Rose,,Iran,Critical Manufacturing; Defense Industrial Base,[Ajax Security Team](https://attack.mitre.org/groups/G0130) is a group that has been active since at least 2010 and believed to be operating out of Iran. By 2014 [Ajax Security Team](https://attack.mitre.org/groups/G0130) transitioned from website defacement operations to malware-based cyber espionage campaigns targeting the US defense industrial base and Iranian users of anti-censorship technologies.(Citation: FireEye Operation Saffron Rose 2013),6,5,0.046153846153846156,0,0,0,0,0,0,5342,5342,125,42.736,2238,0.017885841324262068,0.014451759790003748,0.023076923076923078,0.016855616863984572,0,0.014909584911258454,1,1,0
G0131,Tonto Team,Tonto Team; Earth Akhlut; BRONZE HUNTLEY; CactusPete; Karma Panda,State,China; Japan; South Korea; Taiwan; United States,Defense Industrial Base; Education; Energy; Financial Services; Government Facilities; Healthcare and Public Health; Information Technology,"[Tonto Team](https://attack.mitre.org/groups/G0131) is a suspected Chinese state-sponsored cyber espionage threat group that has primarily targeted South Korea, Japan, Taiwan, and the United States since at least 2009; by 2020 they expanded operations to include other Asian as well as Eastern European countries. [Tonto Team](https://attack.mitre.org/groups/G0131) has targeted government, military, energy, mining, financial, education, healthcare, and technology organizations, including through the Heartbeat Campaign (2009-2012) and Operation Bitter Biscuit (2017).(Citation: Kaspersky CactusPete Aug 2020)(Citation: ESET Exchange Mar 2021)(Citation: FireEye Chinese Espionage October 2019)(Citation: ARS Technica China Hack SK April 2017)(Citation: Trend Micro HeartBeat Campaign January 2013)(Citation: Talos Bisonal 10 Years March 2020)",15,10,0.11538461538461539,10,8.370000000000001,9.8,7,0.2,0.7,2830,2830,101,28.019801980198018,182,0.009475277,0.009475277,0.4447700103950104,0.009475277,0.3766666666666667,0.3372800606429437,1,1,1
G0133,Nomadic Octopus,Nomadic Octopus; DustSquad,,Russia,Government Facilities,"
[Nomadic Octopus](https://attack.mitre.org/groups/G0133) is a Russian-speaking cyber espionage threat group that has primarily targeted Central Asia, including local governments, diplomatic missions, and individuals, since at least 2014. [Nomadic Octopus](https://attack.mitre.org/groups/G0133) has been observed conducting campaigns involving Android and Windows malware, mainly using the Delphi programming language, and building custom variants.(Citation: Security Affairs DustSquad Oct 2018)(Citation: Securelist Octopus Oct 2018)(Citation: ESET Nomadic Octopus 2018)",7,4,0.053846154,0,0,0,0,0,0,39560,39560,101,391.6831683168317,1716,0.13245299191085874,0.13245299191085874,0.026923076923076925,0.13245299191085874,0,0.039952137,1,1,0
G0134,Transparent Tribe,Transparent Tribe; COPPER FIELDSTONE; APT36; Mythic Leopard; ProjectM,,Afghanistan; India; Pakistan,Defense Industrial Base; Government Facilities,"[Transparent Tribe](https://attack.mitre.org/groups/G0134) is a suspected Pakistan-based threat group that has been active since at least 2013, primarily targeting diplomatic, defense, and research organizations in India and Afghanistan.(Citation: Proofpoint Operation Transparent Tribe March 2016)(Citation: Kaspersky Transparent Tribe August 2020)(Citation: Talos Transparent Tribe May 2021)",14,5,0.1076923076923077,2,8.3,8.8,2,0,1,64698,64698,197,572.5486725663717,1675,0.21661889966250603,0.19361512270719564,0.5141502079002079,0.2097177665759129,0.093333333,0.32701865726528656,1,1,1
